[
  {
    "source_id": "rbciamb_2020_pm10_mean",
    "source_title": "Poluição do ar e internações hospitalares por doenças respiratórias em Volta Redonda (RJ)",
    "source_type": "SCIENTIFIC_ARTICLE",
    "source_url": "https://doi.org/10.5327/Z2176-947820190537",
    "station_name": "VR-Belmonte, VR-Retiro, VR-Santa Cecília",
    "pollutant": "PM10",
    "metric": "DAILY_MEAN_SUMMARY",
    "year": null,
    "period_start": "2013-01-01",
    "period_end": "2015-12-31",
    "value": 29.45,
    "unit": "µg/m³",
    "representativeness": "REPRESENTATIVE",
    "extraction_method": "ARTICLE_TEXT",
    "confidence": "HIGH",
    "notes": "Média diária das concentrações físicas de PM10 no triênio 2013-2015 em Volta Redonda."
  },
  {
    "source_id": "rbciamb_2020_pm10_max",
    "source_title": "Poluição do ar e internações hospitalares por doenças respiratórias em Volta Redonda (RJ)",
    "source_type": "SCIENTIFIC_ARTICLE",
    "source_url": "https://doi.org/10.5327/Z2176-947820190537",
    "station_name": "VR-Belmonte, VR-Retiro, VR-Santa Cecília",
    "pollutant": "PM10",
    "metric": "DAILY_MAX",
    "year": null,
    "period_start": "2013-01-01",
    "period_end": "2015-12-31",
    "value": 132.76,
    "unit": "µg/m³",
    "representativeness": "REPRESENTATIVE",
    "extraction_method": "ARTICLE_TEXT",
    "confidence": "HIGH",
    "notes": "Concentração máxima diária (24h) registrada de PM10 na série 2013-2015."
  },
  {
    "source_id": "rbciamb_2020_pts_mean",
    "source_title": "Poluição do ar e internações hospitalares por doenças respiratórias em Volta Redonda (RJ)",
    "source_type": "SCIENTIFIC_ARTICLE",
    "source_url": "https://doi.org/10.5327/Z2176-947820190537",
    "station_name": "VR-Belmonte, VR-Retiro, VR-Santa Cecília",
    "pollutant": "PTS",
    "metric": "DAILY_MEAN_SUMMARY",
    "year": null,
    "period_start": "2013-01-01",
    "period_end": "2015-12-31",
    "value": 43.28,
    "unit": "µg/m³",
    "representativeness": "REPRESENTATIVE",
    "extraction_method": "ARTICLE_TEXT",
    "confidence": "HIGH",
    "notes": "Média diária das concentrações físicas de PTS no triênio 2013-2015 em Volta Redonda."
  },
  {
    "source_id": "rbciamb_2020_pts_max",
    "source_title": "Poluição do ar e internações hospitalares por doenças respiratórias em Volta Redonda (RJ)",
    "source_type": "SCIENTIFIC_ARTICLE",
    "source_url": "https://doi.org/10.5327/Z2176-947820190537",
    "station_name": "VR-Belmonte, VR-Retiro, VR-Santa Cecília",
    "pollutant": "PTS",
    "metric": "DAILY_MAX",
    "year": null,
    "period_start": "2013-01-01",
    "period_end": "2015-12-31",
    "value": 172.39,
    "unit": "µg/m³",
    "representativeness": "REPRESENTATIVE",
    "extraction_method": "ARTICLE_TEXT",
    "confidence": "HIGH",
    "notes": "Concentração máxima diária registrada de PTS na série 2013-2015."
  },
  {
    "source_id": "rbciamb_2020_o3_mean",
    "source_title": "Poluição do ar e internações hospitalares por doenças respiratórias em Volta Redonda (RJ)",
    "source_type": "SCIENTIFIC_ARTICLE",
    "source_url": "https://doi.org/10.5327/Z2176-947820190537",
    "station_name": "VR-Belmonte, VR-Retiro, VR-Santa Cecília",
    "pollutant": "O3",
    "metric": "DAILY_MEAN_SUMMARY",
    "year": null,
    "period_start": "2013-01-01",
    "period_end": "2015-12-31",
    "value": 41.34,
    "unit": "µg/m³",
    "representativeness": "REPRESENTATIVE",
    "extraction_method": "ARTICLE_TEXT",
    "confidence": "HIGH",
    "notes": "Média diária das concentrações físicas de Ozônio (O3) no triênio 2013-2015."
  },
  {
    "source_id": "rbciamb_2020_o3_max",
    "source_title": "Poluição do ar e internações hospitalares por doenças respiratórias em Volta Redonda (RJ)",
    "source_type": "SCIENTIFIC_ARTICLE",
    "source_url": "https://doi.org/10.5327/Z2176-947820190537",
    "station_name": "VR-Belmonte, VR-Retiro, VR-Santa Cecília",
    "pollutant": "O3",
    "metric": "DAILY_MAX",
    "year": null,
    "period_start": "2013-01-01",
    "period_end": "2015-12-31",
    "value": 108.12,
    "unit": "µg/m³",
    "representativeness": "REPRESENTATIVE",
    "extraction_method": "ARTICLE_TEXT",
    "confidence": "HIGH",
    "notes": "Concentração máxima diária registrada de Ozônio (O3) na série 2013-2015."
  },
  {
    "source_id": "rbciamb_2020_pm10_who_exceedance",
    "source_title": "Poluição do ar e internações hospitalares por doenças respiratórias em Volta Redonda (RJ)",
    "source_type": "SCIENTIFIC_ARTICLE",
    "source_url": "https://doi.org/10.5327/Z2176-947820190537",
    "station_name": "VR-Belmonte, VR-Retiro, VR-Santa Cecília",
    "pollutant": "PM10",
    "metric": "OMS_EXCEEDANCE_COUNT",
    "year": null,
    "period_start": "2013-01-01",
    "period_end": "2015-12-31",
    "value": 60,
    "unit": "count",
    "representativeness": "REPRESENTATIVE",
    "extraction_method": "ARTICLE_TEXT",
    "confidence": "HIGH",
    "notes": "Quantidade de dias em que a concentração diária de PM10 violou as diretrizes da OMS (limite de 25 µg/m³ vigente à época)."
  },
  {
    "source_id": "rbciamb_2020_o3_who_exceedance",
    "source_title": "Poluição do ar e internações hospitalares por doenças respiratórias em Volta Redonda (RJ)",
    "source_type": "SCIENTIFIC_ARTICLE",
    "source_url": "https://doi.org/10.5327/Z2176-947820190537",
    "station_name": "VR-Belmonte, VR-Retiro, VR-Santa Cecília",
    "pollutant": "O3",
    "metric": "OMS_EXCEEDANCE_COUNT",
    "year": null,
    "period_start": "2013-01-01",
    "period_end": "2015-12-31",
    "value": 2,
    "unit": "count",
    "representativeness": "REPRESENTATIVE",
    "extraction_method": "ARTICLE_TEXT",
    "confidence": "HIGH",
    "notes": "Quantidade de dias em que a concentração diária de O3 violou o padrão da OMS (limite de 100 µg/m³)."
  },
  {
    "source_id": "inea_rqar_2015_o3_belmonte_max",
    "source_title": "Relatório de Qualidade do Ar do Estado do Rio de Janeiro - Ano Base 2015",
    "source_type": "INEA_REPORT",
    "source_url": "http://www.inea.rj.gov.br/ar-agua-e-solo/monitoramento-da-qualidade-do-ar/relatorios-de-qualidade-do-ar/",
    "station_name": "VR-Belmonte",
    "pollutant": "O3",
    "metric": "HOURLY_MAX",
    "year": 2015,
    "period_start": "2015-01-01",
    "period_end": "2015-12-31",
    "value": 198,
    "unit": "µg/m³",
    "representativeness": "REPRESENTATIVE",
    "extraction_method": "PDF_TABLE",
    "confidence": "HIGH",
    "notes": "Maior concentração horária registrada de Ozônio (O3) na estação VR-Belmonte durante o ano de 2015."
  },
  {
    "source_id": "inea_rqar_2015_pts_santa_cecilia_max",
    "source_title": "Relatório de Qualidade do Ar do Estado do Rio de Janeiro - Ano Base 2015",
    "source_type": "INEA_REPORT",
    "source_url": "http://www.inea.rj.gov.br/ar-agua-e-solo/monitoramento-da-qualidade-do-ar/relatorios-de-qualidade-do-ar/",
    "station_name": "VR-Santa Cecília",
    "pollutant": "PTS",
    "metric": "DAILY_MAX",
    "year": 2015,
    "period_start": "2015-01-01",
    "period_end": "2015-12-31",
    "value": 156,
    "unit": "µg/m³",
    "representativeness": "REPRESENTATIVE",
    "extraction_method": "PDF_TABLE",
    "confidence": "HIGH",
    "notes": "Maior concentração diária (24h) registrada de Partículas Totais em Suspensão (PTS) na estação VR-Santa Cecília durante o ano de 2015."
  }
]
